{
  "schema_version": "1.0.0",
  "identities": [
    {
      "id": "mat_watanabe2026_niobium_cylinder",
      "version": "1.0.0",
      "category": "metal",
      "name": "Watanabe (2026) niobium cylinder",
      "names": {
        "en": "Watanabe (2026) niobium cylinder",
        "zh": "Watanabe (2026) niobium cylinder",
        "ja": "Watanabe (2026) niobium cylinder",
        "de": "Watanabe (2026) niobium cylinder"
      },
      "aliases": [
        {
          "language": "en",
          "text": "Watanabe 2026 Nb cylinder (at least 99.5 mass% Nb)"
        }
      ],
      "identity_scope": "Source-qualified niobium cylinder reported by H. Watanabe (2026), DOI 10.1007/s10765-026-03765-z, Section 2.1.1; at least 99.5 mass% Nb with about 0.12 wt% Ta. This scope does not assert chemically pure Nb, a certified grade, or equivalence to other niobium specimens.",
      "evidence": [
        {
          "source_id": "watanabe2026_niobium_thermophysical",
          "url": "https://link.springer.com/article/10.1007/s10765-026-03765-z",
          "locator": "Section 2.1.1, PDF pages 4-5, niobium cylinder description and Archimedes density at 293 K",
          "supports": [
            "material_identity"
          ]
        }
      ]
    }
  ],
  "grades": [],
  "records": [
    {
      "id": "state_watanabe2026_niobium_cylinder_density",
      "version": "1.0.0",
      "identity_id": "mat_watanabe2026_niobium_cylinder",
      "grade_id": null,
      "name": "Watanabe (2026) niobium cylinder, source-reported density state",
      "names": {
        "en": "Watanabe (2026) niobium cylinder, source-reported density state",
        "zh": "Watanabe (2026) niobium cylinder, source-reported density state",
        "ja": "Watanabe (2026) niobium cylinder, source-reported density state",
        "de": "Watanabe (2026) niobium cylinder, source-reported density state"
      },
      "aliases": [],
      "source_designation": "Niobium cylinder described in Section 2.1.1",
      "state": {
        "product_form": {
          "status": "reported",
          "text": "Cylinder approximately 100 mm long and 2.0011 mm in diameter.",
          "evidence": [
            {
              "source_id": "watanabe2026_niobium_thermophysical",
              "url": "https://link.springer.com/article/10.1007/s10765-026-03765-z",
              "locator": "Section 2.1.1, PDF pages 4-5, niobium cylinder description and Archimedes density at 293 K",
              "supports": [
                "state"
              ]
            }
          ],
          "notes": "Dimensions describe the source specimen; density is not recalculated from them."
        },
        "processing": {
          "status": "not_verified",
          "text": null,
          "evidence": [],
          "notes": "The handoff did not provide this detail; absence from the original source has not been established for this field."
        },
        "temper_or_heat_treatment": {
          "status": "not_reported_in_inspected_source",
          "text": null,
          "evidence": [],
          "notes": "Section 2.1.2 discusses thermal treatment, but its timing cannot be assigned to the density measurement."
        },
        "conditioning": {
          "status": "not_reported_in_inspected_source",
          "text": null,
          "evidence": [],
          "notes": "Not reported for the density measurement in the inspected source scope, according to the parent-thread handoff."
        },
        "composition_or_purity": {
          "status": "reported",
          "text": "At least 99.5 mass% Nb; about 0.12 wt% Ta.",
          "evidence": [
            {
              "source_id": "watanabe2026_niobium_thermophysical",
              "url": "https://link.springer.com/article/10.1007/s10765-026-03765-z",
              "locator": "Section 2.1.1, PDF pages 4-5, niobium cylinder description and Archimedes density at 293 K",
              "supports": [
                "state"
              ]
            }
          ],
          "notes": "These reported fractions are not a complete composition or a certified purity/grade. No exact Nb:1 stoichiometry is asserted."
        },
        "reinforcement": {
          "status": "not_verified",
          "text": null,
          "evidence": [],
          "notes": "The handoff did not provide this detail; absence from the original source has not been established for this field."
        },
        "porosity": {
          "status": "not_verified",
          "text": null,
          "evidence": [],
          "notes": "The handoff did not provide this detail; absence from the original source has not been established for this field."
        },
        "orientation": {
          "status": "not_verified",
          "text": null,
          "evidence": [],
          "notes": "The handoff did not provide this detail; absence from the original source has not been established for this field."
        }
      },
      "source_scope": "Source-qualified niobium cylinder reported by H. Watanabe (2026), DOI 10.1007/s10765-026-03765-z, Section 2.1.1; at least 99.5 mass% Nb with about 0.12 wt% Ta. This scope does not assert chemically pure Nb, a certified grade, or equivalence to other niobium specimens. This state describes the density measurement only; thermal-run treatment is not transferred to it.",
      "evidence": [
        {
          "source_id": "watanabe2026_niobium_thermophysical",
          "url": "https://link.springer.com/article/10.1007/s10765-026-03765-z",
          "locator": "Section 2.1.1, PDF pages 4-5, niobium cylinder description and Archimedes density at 293 K",
          "supports": [
            "state"
          ]
        }
      ],
      "property_ids": [
        "refprop_watanabe2026_niobium_cylinder_mass_density"
      ],
      "evaluation_support": "catalog_only"
    }
  ]
}
